{
  "manifest_version": "bounder-release-manifest/v2",
  "release_version": "1.2.8",
  "license": "Apache-2.0",
  "generated_at": "2026-10-02T23:44:56Z",
  "publisher_source": {
    "repository": "https://github.com/NellInc/Bounder",
    "commit": "8312e0f62a9cc7e204df374f59e02c2d1a5ae8e3",
    "discovery_ref": "main"
  },
  "evidence_producers": [
    {
      "role": "decision_producer",
      "repository": "https://github.com/NellInc/Bounder-from-org",
      "commit": "ad57979201dad3396ca5f77cb02a535b9a57e094",
      "discovery_ref": "master",
      "generator": "scripts/export-website-artifacts.py@1",
      "inputs": [
        {
          "path": "scripts/export-website-artifacts.py",
          "bytes": 9583,
          "sha256": "34d17f725824052b4512f0149117a451844320734adaee3cee583daa396cf96a"
        },
        {
          "path": "server/go-bounder-io/cmd/bounder-attestation-check/main.go",
          "bytes": 1524,
          "sha256": "7541c1172d6d48fdb4469d20cd654e4d9826f4da135c40a1cd11a09a4ba97a61"
        },
        {
          "path": "server/go-bounder-io/cmd/bounder-fleet-continuity/main.go",
          "bytes": 37210,
          "sha256": "5e8e898d4e2f62bc1db73180b67cb1da8e4fb662829361451bea8920e391baf0"
        },
        {
          "path": "server/go-bounder-io/cmd/bounder-fleet-continuity/main_test.go",
          "bytes": 14268,
          "sha256": "e5eee99dc87be527957b65c8ec110a21c5e32d3b202ea46a54f72455f7873e46"
        },
        {
          "path": "server/go-bounder-io/cmd/bounder-fleet-lab/main.go",
          "bytes": 48292,
          "sha256": "5f72ab59ce434d94fc5067ee44e460f4e893a77463de076d1f01a29ca66fe55d"
        },
        {
          "path": "server/go-bounder-io/cmd/bounder-fleet-lab/main_test.go",
          "bytes": 3590,
          "sha256": "f74af616dd1c50a60f55b9cbc1d852a2828fce3d266cfdb2f98f12d844d47e5e"
        },
        {
          "path": "server/go-bounder-io/cmd/bounder-fleet-sim/main.go",
          "bytes": 14060,
          "sha256": "d83578cb902f5c6d6c5a6774e90e69b7cfb1cac7f10b42a60d67238165cfa269"
        },
        {
          "path": "server/go-bounder-io/cmd/bounder-fleet-sim/main_test.go",
          "bytes": 1881,
          "sha256": "47a2f204f08a55e2476bff954cd05c8c18b368e647ae28fe4da1ea3d86728829"
        },
        {
          "path": "server/go-bounder-io/cmd/bounder-interlock-demo/main.go",
          "bytes": 11811,
          "sha256": "0f6abb3af3ae1e72f25eff8be6970d844110a378b9ebdc885ea2991b885b7044"
        },
        {
          "path": "server/go-bounder-io/cmd/bounder-interlock-demo/main_test.go",
          "bytes": 2800,
          "sha256": "19413cc32619e763f61daa28a4c512ddbc9aecb4c728df51971aeb005081abab"
        },
        {
          "path": "server/go-bounder-io/cmd/bounder-manipulator-golden/main.go",
          "bytes": 4743,
          "sha256": "bd93737ffb4b3587a62edd5234fa584f568859d5e1291ba5427df167b9bd8f01"
        },
        {
          "path": "server/go-bounder-io/cmd/bounder-roundtrip-export/main.go",
          "bytes": 4855,
          "sha256": "25dd1c52718e763101d46dfd64acadca8ffbb506da91a80b02190777d6437d48"
        },
        {
          "path": "server/go-bounder-io/cmd/bounder-roundtrip-export/main_test.go",
          "bytes": 1247,
          "sha256": "90d5dba7cdf598466ae351568ddbb1e18e1e08e2f096032a0bddc538ce2860e3"
        },
        {
          "path": "server/go-bounder-io/common/model_common.go",
          "bytes": 387,
          "sha256": "32277d5df1dd8fb07a4a7f4bb2517c8866341328a5328a2df925bf2d7cddf5ed"
        },
        {
          "path": "server/go-bounder-io/config/config.go",
          "bytes": 4872,
          "sha256": "5372e53abec55f3a0f0705f4bf5183032ae1c3165be314d1f6bd13e60e9d1beb"
        },
        {
          "path": "server/go-bounder-io/config/config_test.go",
          "bytes": 1699,
          "sha256": "d186e7ed7d610d7cc5ef71d97f95b2d02cdc0b9130e9a26e18985f78ee7d07c8"
        },
        {
          "path": "server/go-bounder-io/go.mod",
          "bytes": 653,
          "sha256": "d9e9d551491f73ec749ce158e70d540dca570cb309307639aafbbdbd9f9213fe"
        },
        {
          "path": "server/go-bounder-io/go.sum",
          "bytes": 3999,
          "sha256": "417faef5deb8fba61af39094d46182f22e01478546b86af5e46c9a60d7637dec"
        },
        {
          "path": "server/go-bounder-io/integrations/creedspace/admin.go",
          "bytes": 6377,
          "sha256": "3f02121fa45259985708f236191444c4eaf15be5937f6291713b2cd35365c1f2"
        },
        {
          "path": "server/go-bounder-io/integrations/creedspace/admin_test.go",
          "bytes": 2414,
          "sha256": "382f66ca49c3cae0c8bda167ee55b74420a1521a879f01dde1f1dc66e041381e"
        },
        {
          "path": "server/go-bounder-io/integrations/creedspace/audit_payload_test.go",
          "bytes": 3153,
          "sha256": "e67e45674287ff04127693918d597e11df89dbb617322c42c6290fa32059c9b3"
        },
        {
          "path": "server/go-bounder-io/integrations/creedspace/checkpoint.go",
          "bytes": 10303,
          "sha256": "c71c39542d7b07e0d776ee7ac7ba15ac27ecd79ddd08f6914eb2ed1b41c9d3ea"
        },
        {
          "path": "server/go-bounder-io/integrations/creedspace/checkpoint_test.go",
          "bytes": 7184,
          "sha256": "3489d7ecd4e80397f4a88b59586dd519eac3da47a2bf17491c8023e3a426f79f"
        },
        {
          "path": "server/go-bounder-io/integrations/creedspace/client.go",
          "bytes": 11052,
          "sha256": "efc6fc42e8c45805efc64e8db2d2562bce4be236475a7dc1aa28d9ae3b6e1039"
        },
        {
          "path": "server/go-bounder-io/integrations/creedspace/client_test.go",
          "bytes": 4228,
          "sha256": "3e75897a6a6fcef9580b2fefa291f0b0be3f60b6e9e82324c63eaaa9077f83b1"
        },
        {
          "path": "server/go-bounder-io/integrations/creedspace/envelope.go",
          "bytes": 7381,
          "sha256": "394165cb81cff3574ca5e61b5090fca2f27400b634b49f9c9d311f43b6878e21"
        },
        {
          "path": "server/go-bounder-io/integrations/creedspace/envelope_test.go",
          "bytes": 13287,
          "sha256": "529326aa91f02679cdc90c4810049709cf241750deabb986e48081c0bc76f7d1"
        },
        {
          "path": "server/go-bounder-io/integrations/creedspace/guardian.go",
          "bytes": 13322,
          "sha256": "0883757a5d698b048176560565e123ea23ef270b27d49d62e80a24d5bc95c52c"
        },
        {
          "path": "server/go-bounder-io/integrations/creedspace/guardian_state.go",
          "bytes": 3173,
          "sha256": "712c2b5e298655b976f870a5e0581930f888ce63c1714072562deca52707a11d"
        },
        {
          "path": "server/go-bounder-io/integrations/creedspace/manipulator.go",
          "bytes": 5915,
          "sha256": "2fcb3f462848966baf78f8cac2790c5f0ce8287a7c56bffadd4fb64ceac158a5"
        },
        {
          "path": "server/go-bounder-io/integrations/creedspace/manipulator_test.go",
          "bytes": 3676,
          "sha256": "11953caf7b53a3147d405cefb9c01b466db8e487d4c0127da0f527a7981195cb"
        },
        {
          "path": "server/go-bounder-io/integrations/mettle/attestation.go",
          "bytes": 5102,
          "sha256": "51ce6935699273a6cd59e52d8ad8ee0866159170519554d00a6cf8601a89c174"
        },
        {
          "path": "server/go-bounder-io/integrations/mettle/attestation_test.go",
          "bytes": 3422,
          "sha256": "2bf4788d7e41f08fe8860012a424b27933d29bca2d3042147973d708d395aa14"
        },
        {
          "path": "server/go-bounder-io/interlock/manipulator.go",
          "bytes": 14656,
          "sha256": "75df662e60dead1c240813981693b0ededb93ec8186eedc16d2552f34164f2d3"
        },
        {
          "path": "server/go-bounder-io/interlock/manipulator_test.go",
          "bytes": 5364,
          "sha256": "2599c3290b10a4e174d7d394cc716420f1114f409c33a771fbdfeeb8a9f635ac"
        },
        {
          "path": "server/go-bounder-io/interlock/physical_constraints_test.go",
          "bytes": 3476,
          "sha256": "c60490c725468e8b46ffeaa2022a48d46e98e02148c13d4c177bfb0d937b903f"
        },
        {
          "path": "server/go-bounder-io/interlock/policy.go",
          "bytes": 18147,
          "sha256": "046f073aea235caf3d5f91b60ac2982716b76fb4db5937faca776df742b8bca8"
        },
        {
          "path": "server/go-bounder-io/interlock/policy_test.go",
          "bytes": 7554,
          "sha256": "1977744da3d2e98fe563d8deebe488897746dfc9d855b01399d69414c23aed60"
        },
        {
          "path": "server/go-bounder-io/ws-transport/client.go",
          "bytes": 4548,
          "sha256": "023272411902671ea4d41a44258702ae21e2483f4f830ab3bf12e9ead0284dc7"
        },
        {
          "path": "server/go-bounder-io/ws-transport/client_test.go",
          "bytes": 458,
          "sha256": "4e17963a998ddd7cfe9078ac306ed7a883011f439d2c12cb4618fa086c4bfafb"
        },
        {
          "path": "server/go-bounder-io/ws-transport/origin_test.go",
          "bytes": 1096,
          "sha256": "65725fc9612a831f3d30059a4f13a5086a9bd4044e3cc08bd8b62caa06b46cec"
        },
        {
          "path": "server/go-bounder-io/ws-transport/server.go",
          "bytes": 9437,
          "sha256": "ce545ba306ec5752b8f491f43261024a6801efeb335ba6767957b0ef692cd59f"
        }
      ],
      "contracts": [
        {
          "path": "schemas/bounder-evidence-provenance-v1.schema.json",
          "bytes": 2559,
          "sha256": "5c89c7a3c3ef50729db73ee615976ff478082a5ab4327478844a91a4e949fc2b"
        },
        {
          "path": "schemas/bounder-resilience-evidence.v1.schema.json",
          "bytes": 36852,
          "sha256": "af20b8288f607de1f18ff3848e698df1352d808583fff2065c497388d551d9a6"
        },
        {
          "path": "schemas/bounder.receipt-bundle.v1.schema.json",
          "bytes": 6917,
          "sha256": "ac3793153a17a50b9bd0bab7d7c0c27b542b55385bfe0a042b664ee26bbe8228"
        },
        {